{
  "proposal_id": "PROP-ECOLOOM-2026-001",
  "source_bid_id": "BID-ECOLOOM-2026-001",
  "project_name": "Eco-Loom Scrubber Handle Prototype",
  "customer_name": "ECO-LOOM",
  "revision": "Draft 1",
  "status": "draft",
  "created_at": "2026-06-09T12:00:00Z",
  "source_summary_ref": "fixtures/bids/eco_loom_prototype_bid_summary_v1.json",
  "project_ref": "projects/eco_loom/eco_loom_project_capture_v1.json",
  "pricing": {
    "total_price": 650.00,
    "price_per_unit": 65.00,
    "quantity": 10,
    "currency": "USD",
    "pricing_note": ""
  },
  "sections": [
    {
      "title": "Executive Summary",
      "body": "Texas Guitar Exchange is pleased to provide this manufacturing proposal for the Eco-Loom Scrubber Handle Prototype project. This proposal is based on the current governed bid summary and is intended for customer review.",
      "bullets": []
    },
    {
      "title": "Project Scope",
      "body": "This proposal covers manufacturing of 10 units as specified in the current design documentation.",
      "bullets": [
        "CNC machining operations",
        "Setup, finishing, and inspection labor",
        "Finishing materials and consumables"
      ]
    },
    {
      "title": "Deliverables",
      "body": "Upon completion, the following will be delivered:",
      "bullets": [
        "10 completed units per specification",
        "Final inspection documentation",
        "Packaging for safe transport"
      ]
    },
    {
      "title": "Pricing Summary",
      "body": "Pricing is based on the current design revision and stated quantity.",
      "bullets": [
        "Total Price: $650.00",
        "Price Per Unit: $65.00",
        "Quantity: 10 units"
      ]
    },
    {
      "title": "Assumptions",
      "body": "This proposal is based on the following assumptions:",
      "bullets": [
        "Pricing is based on the current design revision.",
        "Pricing assumes the stated production quantity of 10 units.",
        "Material, finish, and schedule changes may require pricing revision.",
        "Customer will supply raw materials as agreed.",
        "Target delivery date: 2026-07-15."
      ]
    },
    {
      "title": "Exclusions",
      "body": "The following are not included in this proposal:",
      "bullets": [
        "Shipping and freight charges",
        "Sales tax and duties",
        "Specialty packaging beyond standard",
        "Design revisions after approval",
        "Material substitutions",
        "Rush scheduling premiums"
      ]
    },
    {
      "title": "Next Steps",
      "body": "To proceed with this project:",
      "bullets": [
        "Review proposal and confirm requirements",
        "Approve proposal to proceed",
        "Confirm material availability and delivery schedule",
        "Production begins upon approval"
      ]
    }
  ],
  "assumptions": [
    {
      "statement": "Pricing is based on the current design revision.",
      "customer_visible": true
    },
    {
      "statement": "Pricing assumes the stated production quantity of 10 units.",
      "customer_visible": true
    },
    {
      "statement": "Material, finish, and schedule changes may require pricing revision.",
      "customer_visible": true
    },
    {
      "statement": "Customer will supply raw materials as agreed.",
      "customer_visible": true
    },
    {
      "statement": "Target delivery date: 2026-07-15.",
      "customer_visible": true
    }
  ],
  "exclusions": [
    "Shipping and freight charges",
    "Sales tax and duties",
    "Specialty packaging beyond standard",
    "Design revisions after approval",
    "Material substitutions",
    "Rush scheduling premiums"
  ],
  "terms": [
    {
      "title": "Proposal Validity",
      "statement": "This proposal is valid for review only while stated assumptions remain unchanged."
    },
    {
      "title": "Revisions",
      "statement": "Design or quantity changes may require proposal revision."
    },
    {
      "title": "Scheduling",
      "statement": "Production scheduling begins after approval and material confirmation."
    }
  ],
  "next_steps": [
    "Review proposal and confirm requirements",
    "Approve proposal to proceed",
    "Confirm material availability and delivery schedule",
    "Production begins upon approval"
  ],
  "notes": [
    "Prototype assumptions have since been superseded by production-quantity customer requirements. This fixture remains a historical sample until ECO-LOOM-BID-REVISION-1.",
    "Internal bid summary reference: fixtures/bids/eco_loom_prototype_bid_summary_v1.json"
  ]
}
