{
  "proposal_id": "PROP-ECOLOOM-PROD-500-2026-001",
  "source_bid_id": "BID-ECOLOOM-PROD-500-2026-001",
  "project_name": "Eco-Loom Scrubber Handle Production",
  "customer_name": "ECO-LOOM",
  "revision": "Draft 1",
  "status": "draft",
  "created_at": "2026-06-11T12:00:00Z",
  "source_summary_ref": "fixtures/bids/eco_loom_production_bid_summary_500_v1.json",
  "project_ref": "projects/eco_loom/eco_loom_project_capture_v1.json",
  "pricing": {
    "total_price": 4150.00,
    "price_per_unit": 8.30,
    "quantity": 500,
    "currency": "USD",
    "pricing_note": ""
  },
  "sections": [
    {
      "title": "Executive Summary",
      "body": "Texas Guitar Exchange is pleased to provide this manufacturing proposal for the Eco-Loom Scrubber Handle Production project. This proposal covers 500 units with shop-supplied materials.",
      "bullets": []
    },
    {
      "title": "Project Scope",
      "body": "This proposal covers manufacturing of 500 units as specified in the current design documentation.",
      "bullets": [
        "CNC machining operations",
        "Shop-supplied wood material",
        "Shop-supplied Velcro material"
      ]
    },
    {
      "title": "Deliverables",
      "body": "Upon completion, the following will be delivered:",
      "bullets": [
        "500 completed units per specification",
        "Final inspection documentation",
        "Packaging for safe transport"
      ]
    },
    {
      "title": "Pricing Summary",
      "body": "Pricing is based on the current design revision and stated quantity.",
      "bullets": [
        "Total Price: $4,150.00",
        "Price Per Unit: $8.30",
        "Quantity: 500 units"
      ]
    },
    {
      "title": "Assumptions",
      "body": "This proposal is based on the following assumptions:",
      "bullets": [
        "Pricing is based on the current design revision.",
        "Pricing assumes the stated production quantity of 500 units.",
        "Material, finish, and schedule changes may require pricing revision.",
        "Shop will supply wood and Velcro materials.",
        "Labor, finishing, and packaging requirements pending confirmation."
      ]
    },
    {
      "title": "Exclusions",
      "body": "The following are not included in this proposal:",
      "bullets": [
        "Finishing labor (pending requirements)",
        "Packaging materials (pending requirements)",
        "Shipping and freight charges",
        "Sales tax and duties",
        "Design revisions after approval"
      ]
    }
  ],
  "assumptions": [
    {
      "statement": "Pricing is based on the current design revision.",
      "customer_visible": true
    },
    {
      "statement": "Pricing assumes the stated production quantity of 500 units.",
      "customer_visible": true
    },
    {
      "statement": "Material, finish, and schedule changes may require pricing revision.",
      "customer_visible": true
    },
    {
      "statement": "Shop will supply wood and Velcro materials.",
      "customer_visible": true
    },
    {
      "statement": "Delivery schedule to be confirmed.",
      "customer_visible": true
    }
  ],
  "exclusions": [
    "Finishing labor (pending requirements)",
    "Packaging materials (pending requirements)",
    "Shipping and freight charges",
    "Sales tax and duties",
    "Design revisions after approval"
  ],
  "terms": [
    {
      "title": "Proposal Validity",
      "statement": "This proposal is valid for review only while stated assumptions remain unchanged."
    },
    {
      "title": "Revisions",
      "statement": "Design or quantity changes may require proposal revision."
    },
    {
      "title": "Scheduling",
      "statement": "Production scheduling begins after approval and material confirmation."
    }
  ],
  "next_steps": [
    "Review proposal and confirm requirements",
    "Confirm finishing and packaging requirements",
    "Confirm delivery schedule",
    "Approve proposal to proceed"
  ],
  "notes": [
    "Production tier: 500 units",
    "See also 100-unit and 250-unit pricing tiers"
  ]
}
